{
  "version": "1.0",
  "last_updated": "2026-02-16T00:00:00Z",
  "departments": [
    {
      "id": "executive",
      "name": "Executive",
      "color": "gold",
      "hex": "#f59e0b"
    },
    {
      "id": "operations",
      "name": "Operations",
      "color": "blue",
      "hex": "#3b82f6"
    },
    {
      "id": "technical",
      "name": "Technical",
      "color": "green",
      "hex": "#10b981"
    }
  ],
  "team": [
    {
      "id": "rai",
      "name": "Rai",
      "emoji": "üëî",
      "role": "CEO",
      "department": "executive",
      "level": 1,
      "reports_to": null,
      "description": "Owner, strategic decisions, final approval",
      "availability": "As Needed",
      "status": "active",
      "responsibilities": [
        "Strategic direction and vision",
        "Final approval on major decisions",
        "Portfolio management oversight",
        "Agent performance review"
      ],
      "model": null,
      "schedule": ["As Needed"]
    },
    {
      "id": "kimi",
      "name": "Kimi",
      "emoji": "ü§µ",
      "role": "Chief of Staff",
      "department": "executive",
      "level": 2,
      "reports_to": "rai",
      "description": "Executive Assistant, Operations Lead",
      "availability": "Continuous",
      "status": "active",
      "responsibilities": [
        "Manage all sub-agents and coordinate team",
        "Compile reports from team members",
        "Execute complex tasks requiring judgment",
        "Quality control on all outputs",
        "Spawn coding tasks to Alex",
        "Review and test all code before presentation"
      ],
      "model": {
        "name": "Moonshot Kimi K2.5",
        "provider": "moonshot",
        "context_window": "256K",
        "cost_tier": "Standard"
      },
      "schedule": ["Continuous", "Primary Interface"]
    },
    {
      "id": "dave",
      "name": "Dave",
      "emoji": "üìã",
      "role": "Chief Briefer",
      "department": "operations",
      "level": 3,
      "reports_to": "kimi",
      "description": "All daily and weekly briefings",
      "availability": "Scheduled",
      "status": "active",
      "responsibilities": [
        "Deliver morning briefings",
        "Compile end-of-day summaries",
        "Generate weekly trading reports",
        "Track task completion"
      ],
      "model": {
        "name": "Haiku",
        "provider": "anthropic",
        "cost_tier": "Efficient"
      },
      "schedule": ["6:00 AM Daily", "7:00 PM Daily", "Sun 6:00 PM"]
    },
    {
      "id": "bob",
      "name": "Bob",
      "emoji": "üìä",
      "role": "Senior Analyst",
      "department": "operations",
      "level": 3,
      "reports_to": "kimi",
      "description": "Deep fundamental research on earnings plays",
      "availability": "Scheduled",
      "status": "active",
      "responsibilities": [
        "Identify earnings candidates daily",
        "Research fundamentals and news",
        "Assess risk factors",
        "Write detailed findings"
      ],
      "model": {
        "name": "Kimi K2.5",
        "provider": "moonshot",
        "cost_tier": "Reasoning"
      },
      "schedule": ["6:30 AM Market Days"]
    },
    {
      "id": "alex",
      "name": "Alex",
      "emoji": "üë®‚Äçüíª",
      "role": "Junior Developer",
      "department": "technical",
      "level": 3,
      "reports_to": "kimi",
      "description": "Code implementation specialist",
      "availability": "On-Demand",
      "status": "active",
      "responsibilities": [
        "Write Python/JS scripts",
        "Build data parsers",
        "Implement API integrations",
        "Refactor existing code"
      ],
      "model": {
        "name": "DeepSeek V3",
        "provider": "deepseek",
        "context_window": "128K",
        "cost_tier": "90% cheaper"
      },
      "schedule": ["On-Demand", "Spawned for Tasks"]
    }
  ]
}